codigo,descripcion,campo
O073,Falla de la induccion medica del aborto, con otras complicaciones especificadas y las no especificadas
O074,Falla de la induccion medica del aborto, sin complicacion
O075,Otros intentos fallidos de aborto y los no especificados, complicados por infeccion genital y pelviana
O076,Otros intentos fallidos de aborto y los no especificados, complicados por hemorragia excesiva o tardia
O077,Otros intentos fallidos de aborto y los no especificados, complicados por embolia
O078,Otros intentos fallidos de aborto y los no especificados, con otras complicaciones especificadas y las no especificadas
O079,Otros intentos fallidos de aborto y los no especificados, sin complicacion
O08,Complicaciones consecutivas al aborto, al embarazo ectopico y al embarazo molar
O080,Infeccion genital y pelviana consecutiva al aborto, al embarazo ectopico y al embarazo molar
O081,Hemorragia excesiva o tardia consecutiva al aborto, al embarazo ectopico y al embarazo molar
O082,Embolia consecutiva al aborto, al embarazo ectopico y al embarazo molar
O083,Choque consecutivo al aborto, al embarazo ectopico y al embarazo molar
O084,Insuficiencia renal consecutiva al aborto, al embarazo ectopico y al embarazo molar
O085,Trastorno metabolico consecutivo al aborto, al embarazo ectopico y al embarazo molar
O086,Lesion de organos o tejidos de la pelvis consecutivo al aborto, al embarazo ectopico y al embarazo molar
O087,Otras complicaciones venosas consecutiva al aborto, al embarazo ectopico y al embarazo molar
O088,Otras complicaciones consecutivas al aborto, al embarazo ectopico y al embarazo molar
O089,Complicacion no especificada consecutiva al aborto, al embarazo ectopico y al embarazo molar
O10,Hipertension preexistente que complica el embarazo, el parto y el puerperio
O100,Hipertension esencial preexistente que complica el embarazo, el parto y el puerperio
O101,Enfermedad cardiaca hipertensiva preexistente que complica el embarazo, el parto y el puerperio
O102,Enfermedad renal hipertensiva preexistente que complica el embarazo, el parto y el puerperio
O103,Enfermedad cardio
O104,Hipertension secundaria preexistente que complica el embarazo, el parto y el puerperio
O109,Hipertension preexistente no especificada, que complica el embarazo, el parto y el puerperio
O11,Trastornos hipertensivos preexistentes, con proteinuria agregada
O12,Edema y proteinuria gestacional [inducidos por elembarazo] sin hipertension
O120,Edema gestacional
O121,Proteinuria gestacional
O122,Edema gestacional con proteinuria
O13,Hipertension gestacional [inducida por elembarazo] sin proteinuria significativa
O14,Hipertens gestacional [inducida por elembarazo] con proteinuria significativa
O140,Preeclampsia moderada
O141,Preeclampsia severa
O149,Preeclampsia, no especificada
O15,Eclampsia
O150,Preeclampsia en el embarazo
O151,Preeclampsia durante el trabajo de parto
O152,Preeclampsia en el puerperio
O159,Preeclampsia, en periodo no especificado
O16,Hipertension materna no especificada
O20,Hemorragia precoz del embarazo
O200,Amenaza de aborto
O208,Otras hemorragias precoces del embarazo
O209,Hemorragia precoz del embarazo, sin otra especificacion
O21,Vomitos excesivos en el embarazo
O210,Hiperemesis gravidica leve
O211,Hiperemesis gravidica con trastornos metabolicos
O212,Hiperemesis gravidica tardia
O218,Otros vomitos que complican el embarazo
O219,Vomitos del embarazo, no especificado
O22,Complicaciones venosas en el embarazo
O220,Venas varicosas de los miembros inferiores en el embarazo
O221,Varices genitales en el embarazo
O222,Tromboflebitis en el embarazo
O223,Flebotrombosis profunda en el embarazo
O224,Hemorroides en el embarazo
O225,Trombosis venosa cerebral en el embarazo
O228,Otras complicaciones venosas en el embarazo
O229,Complicacion venosa no especificada en el embarazo
O23,Infeccionesion de las vias genitourinarias en el embarazo
O230,Infeccion del riñon en el embarazo
O231,Infeccion de la vejiga urinaria en el embarazo
O232,Infeccion de la uretra en el embarazo
O233,Infeccion de otras partes de las vias urinarias en el embarazo
O234,Infeccion no especificada de las vias urinarias en el embarazo
O235,Infeccion genital en el embarazo
O239,Otras infeccion y las no especificadas de las vias genitourinarias en el embarazo
O24,Diabetes mellitus en el embarazo
O240,Diabetes mellitus preexistente insulinodependiente, en el embarazo
O241,Diabetes mellitus preexistente no insulinodependiente, en el embarazo
O242,Diabetes mellitus preexistente relacionada con desnutricion, en el embarazo
O243,Diabetes mellitus preexistente, sin otra especificacion, en el embarazo
O244,Diabetes mellitus que se origina en el embarazo
O249,Diabetes mellitus no especificada, en el embarazo
O25,Desnutricion en el embarazo
O26,Atencion materna por otras complicaciones relacionadas con el embarazo
O260,Aumento excesivo de peso en el embarazo
O261,Aumento pequeño de peso en el embarazo
O262,Atencion del embarazo en una abortadora habitual
O263,Retencion de dispositivo anticonceptivo intrauterino en el embarazo
O264,Herpes gestacional
O265,Sindrome de hipotension materna
O266,Trastorno del higado en el embarazo, el parto y el puerperio
O267,Subluxacion de la sinfisis (del pubis) en el embarazo, el parto y el puerperio
O268,Otras complicaciones especificadas relacionadas con el embarazo
O269,Complicacion relacionada con el embarazo, no especificada
O28,Hallazgos anormales en el examen prenatal de la madre
O280,Hallazgo hematologico anormal en el examen prenatal de la madre
O281,Hallazgo bioquimico anormal en el examen prenatal de la madre
O282,Hallazgo citologico anormal en el examen prenatal de la madre
O283,Hallazgo ultrasonico anormal en el examen prenatal de la madre
O284,Hallazgo radiologico anormal en el examen prenatal de la madre
O285,Hallazgo cromosomico o genetico anormal en el examen prenatal de la madre
O288,Otros hallazgos anormales en el examen prenatal de la madre
O289,Hallazgo anormal no especificado en el examen prenatal de la madre
O29,Complicaciones de la anestesia administrada durante el embarazo
O290,Complicaciones pulmonares de la anestesia administrada durante el embarazo
O291,Complicaciones cardiacas de la anestesia administrada durante el embarazo
O292,Complicaciones del sistema nervioso central debidas a la anestesia administrada durante el embarazo
O293,Reaccion toxica a la anestesia local administrada durante el embarazo
O294,Cefalalgia inducida por la anestesia espinal o epidural administradas durante el embarazo
O295,Otras complicaciones de la anestesia espinal o epidural administradas durante el embarazo
O296,Falla o dificultad en la intubacion durante el embarazo
O298,Otras complicaciones de la anestesia administrada durante el embarazo
O299,Complicacion no especificada de la anestesia administrada durante el embarazo
O30,Embarazo multiple
O300,Embarazo doble
O301,Embarazo triple
O302,Embarazo cuadruple
O308,Otros embarazos multiples
O309,Embarazo multiple, no especificado
O31,Complicacion especificas del embarazo multiple
O310,Feto papiraceo
O311,Embarazo que continua despues del aborto de un feto o mas
O312,Embarazo que continua despues de la muerte intrauterina de un feto o mas
O318,Otras complicaciones especificadas del embarazo
O32,Atencion materna por presentacion anormal feto
O320,Atencion materna por posicion fetal inestable
O321,Atencion materna por presentacion de nalgas
O322,Atencion materna por posicion fetal oblicua o transversa
O323,Atencion materna por presentacion de cara, de frente o de menton
O324,Atencion materna por cabeza alta en gestacion a termino
O325,Atencion materna por embarazo multiple con presentacion anormal de un feto o mas
O326,Atencion materna por presentacion compuesta
O328,Atencion materna por otras presentaciones anormales del feto
O329,Atencion materna por presentacion anormal no especificada del feto
O33,Atencion materna por desproporcion
O330,Atencion materna por desproporcion debida a deformidad de la pelvis osea en la madre
O331,Atencion materna por desproporcion debida a estrechez general de la pelvis
O332,Atencion materna por desproporcion debida a disminucion del estrecho superior de la pelvis
O333,Atencion materna por desproporcion debida a disminucion del estrecho inferior de la pelvis
O334,Atencion materna por desproporcion fetopelviana de origen mixto, materno y fetal
O335,Atencion materna por desproporcion debida a feto demasiado grande
O336,Atencion materna por desproporcion debida a feto hidrocefalico
O337,Atencion materna por desproporcion debida a otra deformidad fetal
O338,Atencion materna por desproporcion de otro origen
O339,Atencion materna por desproporcion de origen no especificado
O34,Atencion materna por anormalidades conocidas o presuntas de los organos pelvianos de la madre
O340,Atencion materna por anomalia congenita del utero
O341,Atencion materna por tumor del cuerpo del utero
O342,Atencion materna por cicatriz uterina debida a cirugia previa
O343,Atencion materna por incompetencia del cuello uterino
O344,Atencion materna por otra anormalidad del cuello uterino
O345,Atencion materna por otras anormalidades del utero gravido
O346,Atencion materna por anormalidad de la vagina
O347,Atencion materna por anormalidad de la vulva y del perineo
O348,Atencion materna por anormalidades de los organos pelvianos
O349,Atencion materna por anormalidad no especificada de organo pelviano
O35,Atencion materna por anormalidad o lesion fetal, conocida o presunta
O350,Atencion materna por (presunta) malformacion del sistema nervioso central en el feto
O351,Atencion materna por (presunta) anormalidad cromosomica en el feto
O352,Atencion materna por (presunta) enfermedad hereditaria en el feto
O353,Atencion materna por (presunta) lesion fetal debida a enfermedad virica en la madre
O354,Atencion materna por (presunta) lesion al feto debida al alcohol
O355,Atencion materna por (presunta) lesion fetal debida a drogas
O356,Atencion materna por (presunta) lesion al feto debida a radiacion
O357,Atencion materna por (presunta) lesion fetal debida a otros procedimientos medicos
O358,Atencion materna por otras (presunta) anormalidades y lesiones fetales
O359,Atencion materna por (presunta) anormalidad y lesion fetal no especificada
O36,Atencion materna por otros problemas fetales, conocidos o presuntos
O360,Atencion materna por isoinmunizacion rhesus
O361,Atencion materna por otra isoinmunizacion
O362,Atencion materna por hidropesia fetal
O363,Atencion materna por signos de hipoxia fetal
O364,Atencion materna por muerte intrauterina
O365,Atencion materna por deficit del crecimiento fetal
O366,Atencion materna por crecimiento fetal excesivo
O367,Atencion materna por feto viable en embarazo abdominal
O368,Atencion materna por otros problemas fetales especificados
O369,Atencion materna por otros problemas fetales no especificados
O40,Polihidramnios
O41,Otros trastornos del liquido amniotico y de las membranas
O410,Oligohidramnios
O411,Infeccion de la bolsa amniotica o de las membranas
O418,Otros trastornos especificados del liquido amniotico y de las membranas
O419,Trastorno del liquido amniotico y de las membranas, no especificado
O42,Ruptura prematura de las membranas
O420,Ruptura prematura de las membranas, e inicio del trabajo de parto dentro de las 24 horas
O421,Ruptura prematura de las membranas, e inicio del trabajo de parto despues de las 24 horas
O422,Ruptura prematura de las membranas, trabajo de parto retrasado por la terapeutica
O429,Ruptura prematura de las membranas, sin otra especificacion
O43,Trastornos placentarios
O430,Sindrome de transfusion placentera
O431,Malformacion de la placenta
O438,Otros trastornos placentarios
O439,Trastorno de la placenta, no especificado
O44,Placenta previa
O440,Placenta previa con especificacion de que no hubo hemorragia
O441,Placenta previa con hemorragia
O45,Desprendimiento prematuro de la placenta
O450,Desprendimiento prematuro de la placenta con defecto de la coagulacion
O458,Otros desprendimientos prematuros de la placenta
O459,Desprendimiento prematuro de la placenta, sin otra especificacion
O46,Hemorragia anteparto no clasificada en otra parte
O460,Hemorragia anteparto con defecto de la coagulacion
O468,Otras hemorragias anteparto
O469,Hemorragia anteparto, no especificada
O47,Falso trabajo de parto
O470,Falso trabajo de parto antes de la 37 semanas completas de gestacion
O471,Falso trabajo de parto antes de la 37 y mas semanas completas de gestacion
O479,Falso trabajo de parto sin otra especificacion
O48,Embarazo prolongado
O60,Parto prematuro
O61,Fracaso de la induccion del trabajo de parto
O610,Fracaso de la induccion medica del trabajo de parto
O611,Fracaso de la induccion instrumental del trabajo de parto
O618,Otros fracasos de la induccion del trabajo de parto
O619,Fracaso no especificado de la induccion del trabajo de parto
O62,Anormalidades de la dinamica del trabajo de parto
O620,Contracciones primarias inadecuadas
O621,Inercia uterina secundaria
O622,Otras inercias uterinas
O623,Trabajo de parto precipitado
O624,Contracciones uterinas hipertonicas, incoordinadas y prolongadas
O628,Otras anomalias dinamicas del trabajo de parto
O629,Anomalia dinamica del trabajo de parto, no especificada
O63,Trabajo de parto prolongado
O630,Prolongacion del primer periodo (del trabajo de parto)
O631,Prolongacion del segundo periodo (del trabajo de parto)
O632,Retraso de la expulsion del segundo gemelo, del tercero, etc
O639,Trabajo de parto prolongado, no especificado
O64,Trabajo de parto obstruido debido mala posicion y presentacion anormal del feto
O640,Trabajo de parto obstruido debido a rotacion incompleta de la cabeza fetal
O641,Trabajo de parto obstruido debido a presentacion de nalgas
O642,Trabajo de parto obstruido debido a presentacion de cara
O643,Trabajo de parto obstruido debido a presentacion de frente
O644,Trabajo de parto obstruido debido a presentacion de hombro
O645,Trabajo de parto obstruido debido a presentacion compuesta
O648,Trabajo de parto obstruido debido a otras presentaciones anormales del feto
O649,Trabajo de parto obstruido debido a presentacion anormal del feto no especificada
O65,Trabajo de parto obstruido debido a anormalidad de la pelvis materna
O650,Trabajo de parto obstruido debido a deformidad de la pelvis
O651,Trabajo de parto obstruido debido a estrechez general de la pelvis
O652,Trabajo de parto obstruido debido a disminucion del estrecho superior de la pelvis
O653,Trabajo de parto obstruido debido a disminucion del estrecho inferior de la pelvis
O654,Trabajo de parto obstruido debido a desproporcion fetopelviana, sin otra especificacion
O655,Trabajo de parto obstruido debido a anomalias de los organos pelvianos maternos
O658,Trabajo de parto obstruido debido a otras anomalias pelvianas maternas
O659,Trabajo de parto obstruido debido a anomalia pelviana no especificada
O66,Otras obstrucciones del trabajo de parto
O660,Trabajo de parto obstruido debido a distocia de hombros
O661,Trabajo de parto obstruido debido a distocia gemelar
O662,Trabajo de parto obstruido debido a distocia por feto inusualmente grande
O663,Trabajo de parto obstruido debido a otras anormalidades del feto
O664,Fracaso de la prueba del trabajo de parto, no especificada
O665,Fracaso no especificado de la aplicacion de forceps o de ventosa extractora
O668,Otras obstrucciones especificadas del trabajo de parto
O669,Trabajo de parto obstruido, sin otra especificacion
O67,Trabajo de parto y parto complicados por hemorragia intraparto no clasificados en otra parte
O670,Hemorragia intraparto con defectos de la coagulacion
O678,Otras hemorragias intraparto
O679,Hemorragia intraparto, no especificada
O68,Trabajo de parto y parto complicados por sufrimiento fetal
O680,Trabajo de parto y parto complicados por anomalias de la frecuencia cardiaca fetal
O681,Trabajo de parto y parto complicados por la presencia de meconio en el liquido amniotico
O682,Trabajo de parto y parto complicados por anomalia de la frecuencia cardiaca fetal asociada con presencia de meconio en liquido amniotico
O683,Trabajo de parto y parto complicados por evidencia bioquimica de sufrimiento fetal
O688,Trabajo de parto y parto complicados por otras evidencias de sufrimiento fetal
O689,Trabajo de parto y parto complicados por sufrimiento fetal, sin otra especificacion
O69,Trabajo de parto y parto complicados por problemas del cordon umbilical
O690,Trabajo de parto y parto complicados por prolapso del cordon umbilical
O691,Trabajo de parto y parto complicados por circular pericervical del cordon, con compresion
O692,Trabajo de parto y parto complicados por otros enredos del cordon
O693,Trabajo de parto y parto complicados por cordon umbilical corto
O694,Trabajo de parto y parto complicados por vasa previa
O695,Trabajo de parto y parto complicados por lesion vascular del cordon
O698,Trabajo de parto y parto complicados por otros problemas del cordon umbilical
O699,Trabajo de parto y parto complicados por problemas no especificados del cordon umbilical
O70,Desgarro perineal durante el parto
O700,Desgarro perineal de primer grado durante el parto
O701,Desgarro perineal de segundo grado durante el parto
O702,Desgarro perineal de tercer grado durante el parto
O703,Desgarro perineal de cuarto grado durante el parto
O709,Desgarro perineal durante el parto, de grado no especificado
O71,Otro trauma obstetrico
O710,Ruptura del utero antes del inicio del trabajo de parto
O711,Ruptura del utero durante el trabajo de parto
O712,Inversion del utero, postparto
O713,Desgarro obstetrico del cuello uterino
O714,Desgarro vaginal obstetrico alto, solo
O715,Otros traumatismos obstetricos de los organos pelvianos
O716,Traumatismo obstetrico de los ligamentos articulaciones de la pelvis
O717,Hematoma obstetrico de la pelvis
O718,Otros traumas obstetricos especificados
O719,Trauma obstetrico, no especificado
O72,Hemorragia postparto
O720,Hemorragia del tercer periodo del parto
O721,Otras hemorragias postparto inmediatas
O722,Hemorragia postparto secundaria o tardia
O723,Defecto de la coagulacion postparto
O73,Retencion de la placenta o de las membranas, sin hemorragia
O730,Retencion de la placenta sin hemorragia
O731,Retencion de fragmentos de la placenta o de las membranas, sin hemorragia
O74,Complicaciones de la anestesia administrada durante el trabajo de parto y el parto
O740,Neumonitis por aspiracion debida a la anestesia administrada durante el trabajo de parto y el parto
O741,Otras complicaciones pulmonares debidas a la anestesia administrada durante el trabajo de parto y el parto
O742,Complicaciones cardiacas de la anestesia administrada durante el trabajo de parto y el parto
O743,Complicaciones del sistema nervioso central por la anestesia administrada durante el trabajo de parto y el parto
O744,Reaccion toxica a la anestesia local administrada durante el trabajo de parto y el parto
O745,Cefalalgia inducida por la anestesia espinal o epidural administradas durante el trabajo de parto y el parto
O746,Otras complicaciones de la anestesia espinal o epidural administradas durante el trabajo de parto y el parto
O747,Falla o dificultad en la intubacion durante el trabajo de parto y el parto
O748,Otras complicaciones de la anestesia administrada durante el trabajo de parto y el parto
O749,Complicacion no especificada de la anestesia administrada durante el trabajo de parto y el parto
O75,Otras complicaciones del trabajo de parto y del parto no clasificadas en otra parte
O750,Sufrimiento materno durante el trabajo de parto y el parto
O751,Choque durante o despues del trabajo de parto y el parto
O752,Pirexa durante el trabajo de parto, no clasificada en otra parte
O753,Otras infecciones durante el trabajo de parto
O754,Otras complicaciones de procedimientos y de cirugia obstetrica
O755,Retraso del parto despues de la ruptura artificial de las membranas
O756,Retraso del parto despues de la ruptura espontanea o no especificada de las membranas
O757,Parto vaginal posterior a una cesarea previa
O758,Otras complicaciones especificadas del trabajo de parto y del parto
O759,Complicacion no especificada del trabajo de parto y del parto
O80,Parto unico espontaneo
O800,Parto unico espontaneo, presentacion cefalica de vertice
O801,Parto unico espontaneo, presentacion de nalgas o podalica
O808,Parto unico espontaneo, otras presentaciones
O809,Parto unico espontaneo, sin otra especificacion
O81,Parto unico con forceps y ventosa extractora
O810,Parto con forceps bajo
O811,Parto con forceps medio
O812,Parto con forceps medio con rotacion
O813,Parto con forceps de otros tipos y los no especificados
O814,Parto con ventosa extractora
O815,Parto con combinacion de forceps y ventosa extractora
O82,Parto unico por cesarea
O820,Parto por cesarea electiva
O821,Parto por cesarea de emergencia
O822,Parto por cesarea con histerectomia
O828,Otros partos unicos por cesarea
O829,Parto por cesarea, sin otra especificacion
O83,Otros partos unicos asistidos
O830,Extraccion de nalgas
O831,Otros partos unicos asistidos, de nalgas
O832,Otros partos unicos con ayuda de manipulacion obstetrica
O833,Parto de feto viable en embarazo abdominal
O834,Operacion destructiva para facilitar el parto
O838,Otros partos unicos asistidos especificados
O839,Parto unico asistido, sin otra especificacion
O84,Parto multiple
O840,Parto multiple, todos espontaneos
O841,Parto multiple, todos forceps y ventosa extractora
O842,Parto multiple, todos por cesarea
O848,Otros partos multiples
O849,Parto multiple, no especificado
O85,Sepsis puerperal
O86,Otras infecciones puerperales
O860,Infeccion de herida quirurgica obstetrica
O861,Otras infecciones genitales consecutivas al parto
O862,Infeccion de las vias urinarias consecutiva al parto
O863,Otras infecciones de las vias genitourinarias consecutivas al parto
O864,Pirexa de origen desconocido consecutiva al parto
O868,Otras infecciones puerperales especificadas
O87,Complicaciones venosas en el puerperio
O870,Tromboflebitis superficial en el puerperio
O871,Flebotrombosis profunda en el puerperio
O872,Hemorroides en el puerperio
O873,Trobosis venosa cerebral en el puerperio
O878,Otras complicaciones venosas en el puerperio
O879,Complicacion venosa en el puerperio, no especificada
O88,Embolia obstetrica
O880,Embolia gaseosa, obstetrica
O881,Embolia de liquido amniotico
O882,Embolia de coagulo sanguineo, obstetrica
O883,Embolia septica y piemica, obstetrica
O888,Otras embolias obstetricas
O89,Complicacion de la anestesia administrada durante el puerperio
O890,Complicaciones pulmonares de la anestesia administrada durante el puerperio
O891,Complicaciones cardiacas de la anestesia administrada durante el puerperio
O892,Complicaciones del sistema nervioso central debidas a la anestesia administrada durante el puerperio
O893,Reaccion toxica a la anestesia local administrada durante el puerperio
O894,Cefalalgia inducida por la anestesia espinal o epidural administradas durante el puerperio
O895,Otras complicaciones de la anestesia espinal o epidural administradas durante el puerperio
O896,Falla o dificultad en la intubacion durante el puerperio
O898,Otras complicaciones de la anestesia administrada durante el puerperio
O899,Complicacion no especificada de la anestesia administrada durante el trabajo puerperio
O90,Complicaciones del puerperio no clasificadas en otra parte
O900,Dehiscencia de sutura de cesarea
O901,Dehiscencia de sutura obstetrica perineal
O902,Hematoma de herida quirurgica obstetrica
O903,Cardiomiopatia en el puerperio
O904,Insuficiencia renal aguda postparto
O905,Tiroiditis postparto
O908,Otras complicaciones puerperales, no clasificadas en otra parte
O909,Complicacion puerperal , no especificada
O91,Infecciones de la mama asociadas con el parto
O910,Infecciones del pezon asociadas con el parto
O911,Absceso de la mama asociado con el parto
O912,Mastitis no purulenta asociada con el parto
O92,Otros trastornos de la mama y de la lactancia asociados con el parto
O920,Retraccion del pezon asociada con el parto
O921,Fisuras del pezon asociadas con el parto
O922,Otros trastornos de la mama y los no especificados asociados con el parto
O923,Agalactia
O924,Hipogalactia
O925,Supresion de la lactancia
O926,Galactorrea
O927,Otros trastornos y los no especificados de la lactancia
O93,Muerte materna de causa basica especificada en otro capitulo relacionada con el embarazo
O95,Muerte obstetrica de causa no especificada
O96,Muerte materna debida a cualquier causa obstetrica que ocurre despues de 42 dias pero antes de un año del parto
O97,Muerte por secuelas de causas obstetricas directas
O98,Enfermedades maternas infecciosas y parasitarias clasificables en otra parte, pero que complican el embarazo, el parto y el puerperio
O980,Tuberculosis que complica el embarazo, el parto y el puerperio
O981,Sifilis que complica el embarazo, el parto y el puerperio
O982,Gonorrea a que complica el embarazo, el parto y el puerperio
O983,Otras infecciones con un modo de transmision predominante sexual que complican el embarazo, el parto y el puerperio
O984,Hepatitis viral que complica el embarazo, el parto y el puerperio
O985,Otras enfermedades virales que complican el embarazo, el parto y el puerperio
O986,Enfermedades causadas por protozoarios que complican el embarazo, el parto y el puerperio
O988,Otras enfermedades infecciosas y parasitarias maternas que complican el embarazo, el parto y el puerperio
O989,Enfermedad infecciosa y parasitaria materna no especificada que complica el embarazo, el parto y el puerperio
O99,Otras enfermedades maternas clasificables en otra parte, pero que complican el embarazo, el parto y el puerperio
O990,Anemia que complica el embarazo, el parto y el puerperio
O991,Otras enfermedades de la sangre y de los organos hematopoyeticos y ciertos trastornos que afectan el sistema inmunitario cuando complican el embarazo, el parto y el puerperio
O992,Enfermedades endocrinas, de la nutricion y del metabolismo que complican el embarazo, el parto y el puerperio
