codigo,descripcion,campo
O993,Trastornos mentales y enfermedades del sistema nervioso que complican el embarazo, el parto y el puerperio
O994,Enfermedades del sistema circulatorio que complican el embarazo, el parto y el puerperio
O995,Enfermedades del sistema respiratorio que complican el embarazo, el parto y el puerperio
O996,Enfermedades del sistema digestivo que complican el embarazo, el parto y el puerperio
O997,Enfermedades de la piel y de tejido subcutaneo que complican el embarazo, el parto y el puerperio
O998,Otras enfermedades especificadas y afecciones que complican el embarazo, el parto y el puerperio
P00,Feto y recien nacido afectados por condiciones de la madre no necesariamente relacionadas con el embarazo presente
P000,Feto y recien nacido afectados por trastornos hipertensivos de la madre
P001,Feto y recien nacido afectados por enfermedades renales y de las vias urinarias de la madre
P002,Feto y recien nacido afectados por enfermedades infecciosas y parasitarias de la madre
P003,Feto y recien nacido afectados por enfermedades circulatorias y respiratorias de la madre
P004,Feto y recien nacido afectados por trastornos nutricionales de la madre
P005,Feto y recien nacido afectados por traumatismo de la madre
P006,Feto y recien nacido afectados por procedimiento quirurgico de la madre
P007,Feto y recien nacido afectados por otro procedimiento medico de la madre, no clasificado en otra parte
P008,Feto y recien nacido afectados por otras afecciones maternas
P009,Feto y recien nacido afectados por afeccion materna no especificada
P01,Feto y recien nacido afectados por complicaciones maternas del embarazo
P010,Feto y recien nacido afectados por incompetencia del cuello uterino
P011,Feto y recien nacido afectados por ruptura prematura de las membranas
P012,Feto y recien nacido afectados por oligohidramnios
P013,Feto y recien nacido afectados por polihidramnios
P014,Feto y recien nacido afectados por embarazo ectopico
P015,Feto y recien nacido afectados por embarazo multiple
P016,Feto y recien nacido afectados por muerte materna
P017,Feto y recien nacido afectados por presentacion anomala antes del trabajo de parto
P018,Feto y recien nacido afectados por otras complicaciones maternas del embarazo
P019,Feto y recien nacido afectados por complicaciones maternas no especificadas del embarazo
P02,Feto y recien nacido afectados por complicaciones de la placenta, del cordon umbilical y de las membranas
P020,Feto y recien nacido afectados por placenta previa
P021,Feto y recien nacido afectados por otras formas de desprendimiento y de hemorragia placentarios
P022,Feto y recien nacido afectados por otras anomalias morfologicas y funcionales de la placenta y las no especificadas
P023,Feto y recien nacido afectados por sindromes de transfusion placentaria
P024,Feto y recien nacido afectados por prolapso del cordon umbilical
P025,Feto y recien nacido afectados por otra compresion del cordon umbilical
P026,Feto y recien nacido afectados por otras complicaciones del cordon umbilical y las no especificadas
P027,Feto y recien nacido afectados por corioamnionitis
P028,Feto y recien nacido afectados por otras anormalidades de las membranas
P029,Feto y recien nacido afectados por anormalidad no especificada de las membranas
P03,Feto y recien nacido afectados por otras complicaciones del trabajo de parto y del parto
P030,Feto y recien nacido afectados por parto y extraccion de nalgas
P031,Feto y recien nacido afectados por otra presentacion anomala, posicion anomala y desproporcion durante el trabajo de parto y el parto
P032,Feto y recien nacido afectados por parto con forceps
P033,Feto y recien nacido afectados por parto con ventosa extractora
P034,Feto y recien nacido afectados por parto por cesarea
P035,Feto y recien nacido afectados por parto precipitado
P036,Feto y recien nacido afectados por contracciones uterinas anormales
P038,Feto y recien nacido afectados por otras complicaciones especificadas del trabajo de parto y del parto
P039,Feto y recien nacido afectados por complicaciones no especificadas del trabajo de parto y del parto
P04,Feto y recien nacido afectados por influencias nocivas transmitidas a traves de la placenta o de la leche materna
P040,Feto y recien nacido afectados por anestesia y analgesia materna en el embarazo, en el trabajo de parto y en el parto
P041,Feto y recien nacido afectados por otras medicaciones maternas
P042,Feto y recien nacido afectados por tabaquismo de la madre
P043,Feto y recien nacido afectados por alcoholismo de la madre
P044,Feto y recien nacido afectados por drogadiccion materna
P045,Feto y recien nacido afectados por el uso materno de sustancias quimicas nutricionales
P046,Feto y recien nacido afectados por exposicion materna a sustancias quimicas ambientales
P048,Feto y recien nacido afectados por otras influencias nocivas de la madre
P049,Feto y recien nacido afectados por influencias nocivas de la madre, no especificadas
P05,Retardo del crecimiento fetal y desnutricion fetal
P050,Bajo peso para la edad gestacional
P051,Pequeño para edad gestacional
P052,Desnutricion fetal, sin mencion de peso o talla bajos para la edad gestacional
P059,Retardo del crecimiento fetal, no especificado
P07,Trastornos relacionados con la duracion corta de la gestacion y con bajo peso al nacer, no clasificados en otra parte
P070,Peso extremadamente bajo al nacer
P071,Otro peso bajo al nacer
P072,Inmaturidad extrema
P073,Otros recien nacidos pretermino
P08,Trastornos relacionados con el embarazo prolongado y con sobrepeso al nacer
P080,Recien nacido excepcionalmente grande
P081,Otros recien nacidos con sobrepeso para la edad gestacional
P082,Recien nacido postermino sin sobrepeso para su edad gestacional
P10,Hemorragia y laceracion intracraneal debidas a traumatismo del nacimiento
P100,Hemorragia subdural debida a traumatismo del nacimiento
P101,Hemorragia cerebral debida a traumatismo del nacimiento
P102,Hemorragia intraventricular debida a traumatismo del nacimiento
P103,Hemorragia subaracnoidea debida a traumatismo del nacimiento
P104,Desgarro tentorial debido a traumatismo del nacimiento
P108,Otras hemorragias y laceraciones intracraneales debidas a traumatismo del nacimiento
P109,Hemorragia y laceracion intracraneales no especificadas, debidas a traumatismo del nacimiento
P11,Otros traumatismos del nacimiento en el sistema nervioso central
P110,Edema cerebral debido a traumatismo del nacimiento
P111,Otras lesiones especificadas del encefalo debidas a traumatismo del nacimiento
P112,Lesion no especificada del encefalo, debida a traumatismo del nacimiento
P113,Traumatismo del nacimiento en el nervio facial
P114,Traumatismo del nacimiento en otros nervios craneales
P115,Traumatismo del nacimiento en la columna vertebral y en la medula espinal
P119,Traumatismo del nacimiento en el sistema nervioso central, no especificado
P12,Traumatismo del nacimiento en el cuero cabelludo
P120,Cefalohematoma debido a traumatismo del nacimiento
P121,Caput succedaneum debido a traumatismo del nacimiento
P122,Hemorragia epicraneal subaponeurotica debida a traumatismo del nacimiento
P123,Equimosis del cuero cabelludo debida a traumatismo del nacimiento
P124,Traumatismo en el cuero cabelludo del recien nacido por monitoreo fetal
P128,Otros traumatismos del nacimiento en el cuero cabelludo
P129,Traumatismo del nacimiento en el cuero cabelludo, no especificado
P13,Traumatismo del esqueleto durante el nacimiento
P130,Fractura del craneo debida a traumatismo del nacimiento
P131,Otros traumatismos del craneo durante el nacimiento
P132,Traumatismo del femur durante el nacimiento
P133,Traumatismo de otros huesos largos durante el nacimiento
P134,Fractura de la clavicula debida a traumatismo del nacimiento
P138,Traumatismo del nacimiento en otras partes del esqueleto
P139,Traumatismo no especificado del esqueleto durante el nacimiento
P14,Traumatismos del sistema nervioso periferico durante el nacimiento
P140,Paralisis de erb debida a traumatismo del nacimiento
P141,Paralisis de klumpke debida a traumatismo dl nacimiento
P142,Paralisis del nervio frenico debida a traumatismo del nacimiento
P143,Otro traumatismo del plexo braquial durante el nacimiento
P148,Traumatismo durante el nacimiento en otras partes del sistema nervioso periferico
P149,Traumatismo no especificado del sistema nervioso periferico durante el nacimiento
P15,Otros traumatismos del nacimiento
P150,Lesion del higado durante el nacimiento
P151,Lesion del bazo durante el nacimiento
P152,Traumatismo del musculo esternocleidomastoideo durante el nacimiento
P153,Traumatismo ocular durante el nacimiento
P154,Traumatismo facial durante el nacimiento
P155,Traumatismo de los genitales externos durante el nacimiento
P156,Necrosis grasa subcutanea debida a traumatismo del nacimiento
P158,Otros traumatismos especificados, durante el nacimiento
P159,Traumatismo no especificado, durante el nacimiento
P20,Hipoxia intrauterina
P200,Hipoxia intrauterina notada por primera vez antes del inicio del trabajo de parto
P201,Hipoxia intrauterina notada por primera vez durante el trabajo de parto
P209,Hipoxia intrauterina, no especificada
P21,Asfixia del nacimiento
P210,Asfixia del nacimiento, severa
P211,Asfixia del nacimiento, leve y moderada
P219,Asfixia del nacimiento, no especificada
P22,Dificultad respiratoria del recien nacido
P220,Sindrome de dificultad respiratoria del recien nacido
P221,Taquipnea transitoria del recien nacido
P228,Otras dificultades respiratorias del recien nacido
P229,Dificultad respiratoria del recien nacido, no especificada
P23,Neumonia congenita
P230,Neumonia congenita debida a agente viral
P231,Neumonia congenita debida a chlamydia
P232,Neumonia congenita debida a estafilococos
P233,Neumonia congenita debida a estreptococos del grupo b
P234,Neumonia congenita debida a escherichia coli
P235,Neumonia congenita debida a pseudomonas
P236,Neumonia congenita debida a otros agentes bacterianos
P238,Neumonia congenita debida a otros organismos
P239,Neumonia congenita, organismo no especificado
P24,Sindromes de aspiracion neonatal
P240,Aspiracion neonatal de meconio
P241,Aspiracion neonatal del liquido amniotico y de moco
P242,Aspiracion neonatal de sangre
P243,Aspiracion neonatal de leche y alimento regurgitado
P248,Otros sindromes de aspiracion neonatal
P249,Sindrome de aspiracion neonatal, sin otra especificacion
P25,Enfisema intersticial y afecciones relacionadas, originadas en el periodo perinatal
P250,Enfisema intersticial originado en el periodo perinatal
P251,Neumotorax originado en el periodo perinatal
P252,Neumomediastino originado en el periodo perinatal
P253,Neumopericardio originado en el periodo perinatal
P258,Otras afecciones relacionadas con el enfisema intersticial, originadas en el periodo perinatal
P26,Hemorragia pulmonar originada en el periodo perinatal
P260,Hemorragia traqueobronquial originada en el periodo perinatal
P261,Hemorragia pulmonar masiva originada en el periodo perinatal
P268,Otras hemorragias pulmonares originadas en el periodo perinatal
P269,Hemorragia pulmonar no especificada, originada en el periodo perinatal
P27,Enfermedades respiratorias cronicas originadas en el periodo perinatal
P270,Sindrome de wilson
P271,Displasia broncopulmonar originada en el periodo perinatal
P278,Otras enfermedades respiratorias cronicas originadas en el periodo perinatal
P279,Enfermedad respiratoria cronica no especificada originada en el periodo perinatal
P28,Otros problemas respiratorios del recien nacido originados en el periodo perinatal
P280,Atelectasia primaria del recien nacido
P281,Otras atelectasias del recien nacido y las no especificadas
P282,Ataque cianotico del recien nacido
P283,Apnea primaria del sueño del recien nacido
